{
  "schema_version": "1.0",
  "package": "robotics-assembly-foundation",
  "version": "0.1.0",
  "demos": [
    {
      "id": "robotics.demo.nema23_belt_linear_axis.v1",
      "title": "NEMA 23 belt-driven linear axis",
      "data_status": "illustrative",
      "maturity": "concept_demo",
      "summary": "A reusable first assembly demo that exercises motor mounting, pulley/belt transmission, linear guidance, carriage, homing, AssemblyGraph mates, and a one-axis URDF export. It is intentionally not a rated motion stage.",
      "sources": ["oriental_motor_pkp_nema23_2026", "hiwin_mg_linear_guideways_2026", "gates_powergrip_gt3_2026", "ros_2_urdf_rolling_2026"],
      "assembly_graph": {
        "nodes": [
          {"id": "axis.structure", "component_ref": "robotics.component.linear_axis_structure.illustrative.v1", "role": "fixed backbone"},
          {"id": "axis.motor_mount", "component_ref": "robotics.component.linear_axis_motor_mount.illustrative.v1", "role": "motor adapter"},
          {"id": "axis.motor", "component_ref": "robotics.component.nema23_stepper_candidate.v1", "role": "prime mover"},
          {"id": "axis.drive_pulley", "component_ref": "robotics.component.timing_pulley_candidate.v1", "role": "drive pulley"},
          {"id": "axis.idler_pulley", "component_ref": "robotics.component.timing_pulley_candidate.v1", "role": "idler/tensioning pulley"},
          {"id": "axis.belt", "component_ref": "robotics.component.gates_powergrip_gt3_belt_candidate.v1", "role": "motion transmission"},
          {"id": "axis.guideway", "component_ref": "robotics.component.hiwin_mg_linear_guide_candidate.v1", "role": "linear guidance", "quantity": 1},
          {"id": "axis.carriage", "component_ref": "robotics.component.linear_axis_carriage_plate.illustrative.v1", "role": "moving payload carrier"},
          {"id": "axis.endstop", "component_ref": "robotics.component.axis_endstop_candidate.v1", "role": "homing/limit evidence"},
          {"id": "axis.controller", "component_ref": "robotics.component.motion_controller_driver_candidate.v1", "role": "motion control"}
        ],
        "edges": [
          {"from": "axis.motor_mount", "to": "axis.structure", "relation": "mounted_to", "interface_ref": "robotics.interface.linear_axis_module_mount.illustrative.v1"},
          {"from": "axis.motor", "to": "axis.motor_mount", "relation": "mounted_to", "interface_ref": "robotics.interface.nema23_motor_mount.candidate.v1"},
          {"from": "axis.drive_pulley", "to": "axis.motor", "relation": "shaft_coupled_to", "interface_ref": "robotics.interface.motor_shaft_to_timing_pulley.candidate.v1"},
          {"from": "axis.belt", "to": "axis.drive_pulley", "relation": "engages", "interface_ref": "robotics.interface.timing_belt_drive.candidate.v1"},
          {"from": "axis.belt", "to": "axis.idler_pulley", "relation": "engages", "interface_ref": "robotics.interface.timing_belt_drive.candidate.v1"},
          {"from": "axis.guideway", "to": "axis.structure", "relation": "mounted_to", "interface_ref": "robotics.interface.linear_guide_rail_to_structure.candidate.v1"},
          {"from": "axis.carriage", "to": "axis.guideway", "relation": "guided_by", "interface_ref": "robotics.interface.linear_guide_carriage_to_plate.candidate.v1"},
          {"from": "axis.belt", "to": "axis.carriage", "relation": "terminated_on", "interface_ref": "robotics.interface.belt_termination_to_carriage.candidate.v1"},
          {"from": "axis.endstop", "to": "axis.structure", "relation": "mounted_to", "interface_ref": "robotics.interface.sensor_mount.illustrative.v1"},
          {"from": "axis.controller", "to": "axis.motor", "relation": "controls", "interface_ref": "robotics.interface.motor_power_and_control.candidate.v1"}
        ]
      },
      "kinematic_model": [
        {"id": "axis.carriage_slide", "type": "prismatic", "parent_node": "axis.structure", "child_node": "axis.carriage", "axis": "+X travel axis to be resolved from selected rail datum", "status": "illustrative", "note": "Travel limits, speed, force, and acceleration are intentionally absent until selected hardware and application loads are known."}
      ],
      "required_inputs": ["payload mass, CoG, and external loads", "travel, speed, acceleration, and duty cycle", "exact motor/driver/guideway/belt/pulley part numbers and controlled drawings", "structural material/process and mounting context", "required accuracy, repeatability, environment, and safety context"],
      "verification_gates": ["Resolve all candidate components and interface drawings.", "Run motor, belt, guideway, structure, fastener, and thermal calculations with reviewed assumptions.", "Check full-stroke collision, belt path, service access, and end-stop/hard-stop strategy.", "Validate AssemblyGraph frame transforms and prismatic URDF model.", "Produce a BOM that marks unresolved candidate lines and does not authorize procurement."],
      "exports": ["FCStd assembly and per-part source FeatureGraphs", "STEP assembly with selected/reviewed physical parts only", "exploded-view image", "BOM with source/revision/status columns", "URDF/Xacro and collision mesh after frame/property verification", "GLB review model"],
      "agent_guidance": "Start with this demo. Present it as a design walkthrough until all exact component records and verification evidence replace the candidate/illustrative records."
    },
    {
      "id": "robotics.demo.parallel_jaw_gripper.v1",
      "title": "Electric parallel-jaw gripper",
      "data_status": "illustrative",
      "maturity": "concept_demo",
      "summary": "A custom end-effector demo that exercises a coupled two-jaw AssemblyGraph, custom jaws, guideway/drive integration, gripper tool frames, and mimic-joint export limitations.",
      "sources": ["hiwin_mg_linear_guideways_2026", "ros_2_urdf_rolling_2026", "ros2_control_joint_kinematics_rolling_2026"],
      "assembly_graph": {
        "nodes": [
          {"id": "gripper.body", "component_ref": "robotics.component.parallel_jaw_gripper_body.illustrative.v1", "role": "fixed gripper body"},
          {"id": "gripper.guideway", "component_ref": "robotics.component.hiwin_mg_linear_guide_candidate.v1", "role": "jaw guidance", "quantity": 1},
          {"id": "gripper.drive", "component_ref": "robotics.component.gripper_leadscrew_drive_candidate.v1", "role": "coupled jaw drive"},
          {"id": "gripper.left_jaw", "component_ref": "robotics.component.gripper_jaw_set.illustrative.v1", "role": "left workpiece-contact jaw"},
          {"id": "gripper.right_jaw", "component_ref": "robotics.component.gripper_jaw_set.illustrative.v1", "role": "right workpiece-contact jaw"},
          {"id": "gripper.controller", "component_ref": "robotics.component.motion_controller_driver_candidate.v1", "role": "gripper motion control"}
        ],
        "edges": [
          {"from": "gripper.guideway", "to": "gripper.body", "relation": "mounted_to", "interface_ref": "robotics.interface.linear_guide_rail_to_structure.candidate.v1"},
          {"from": "gripper.drive", "to": "gripper.body", "relation": "mounted_to", "interface_ref": "robotics.interface.gripper_drive_to_body.candidate.v1"},
          {"from": "gripper.left_jaw", "to": "gripper.guideway", "relation": "guided_by", "interface_ref": "robotics.interface.parallel_jaw_mimic_kinematic.illustrative.v1"},
          {"from": "gripper.right_jaw", "to": "gripper.guideway", "relation": "guided_by", "interface_ref": "robotics.interface.parallel_jaw_mimic_kinematic.illustrative.v1"},
          {"from": "gripper.left_jaw", "to": "gripper.drive", "relation": "driven_by", "interface_ref": "robotics.interface.parallel_jaw_mimic_kinematic.illustrative.v1"},
          {"from": "gripper.right_jaw", "to": "gripper.drive", "relation": "driven_by", "interface_ref": "robotics.interface.parallel_jaw_mimic_kinematic.illustrative.v1"},
          {"from": "gripper.controller", "to": "gripper.drive", "relation": "controls", "interface_ref": "robotics.interface.motor_power_and_control.candidate.v1"}
        ]
      },
      "kinematic_model": [
        {"id": "gripper.left_jaw_slide", "type": "prismatic", "parent_node": "gripper.body", "child_node": "gripper.left_jaw", "axis": "+X opening direction to be resolved", "status": "illustrative", "note": "Physical drive mechanism and joint limits are unselected."},
        {"id": "gripper.right_jaw_mimic", "type": "mimic", "parent_node": "gripper.body", "child_node": "gripper.right_jaw", "axis": "-X opening direction to be resolved", "status": "illustrative", "note": "URDF mimic relationship is not evidence of synchronized hardware or grasp force balance."}
      ],
      "required_inputs": ["workpiece geometry/material and grasp task", "jaw stroke, force, speed, and cycle life", "exact guideway, screw/nut/bearing/motor/controller data", "robot or fixture host interface", "pinch-point, failed-power, and safety context", "material/process and cleaning/environment constraints"],
      "verification_gates": ["Resolve the physical synchronization/drive mechanism and candidate components.", "Calculate force transmission, screw/nut/bearing loading, jaw/body stiffness, fasteners, and duty life.", "Check open, closed, intermediate, and workpiece collision states.", "Verify tool-centre frame and upstream payload/moment limits.", "Validate the URDF mimic approximation in the target simulator and document its limitation."],
      "exports": ["FCStd assembly and individual body/jaw FeatureGraphs", "STEP assembly after exact components are selected", "BOM and custom-part drawing set", "URDF/Xacro plus collision mesh with explicit mimic caveat", "GLB exploded/pose review model", "grasp/clearance evidence report"],
      "agent_guidance": "Build this second. It demonstrates that OrionFlow handles custom parts, purchased components, coupled kinematics, and end-effector-specific verification rather than only simple single parts."
    },
    {